<?xml version="1.0" encoding="UTF-8" standalone="yes"?>
<!--W3C Schema 由 XMLSpy v2006 U 创建 (http://www.altova.com)-->
<xs:schema xmlns:xs="http://www.w3.org/2001/XMLSchema" elementFormDefault="qualified">
	<xs:element name="category">
		<xs:complexType>
			<xs:sequence>
				<xs:element ref="entry" maxOccurs="unbounded"/>
			</xs:sequence>
			<xs:attribute name="chName" use="required">
				<xs:simpleType>
					<xs:restriction base="xs:string">
						<xs:enumeration value="MongoDBServer配置文件"/>
					</xs:restriction>
				</xs:simpleType>
			</xs:attribute>
			<xs:attribute name="enName" use="required">
				<xs:simpleType>
					<xs:restriction base="xs:string">
						<xs:enumeration value="MongoDB"/>
					</xs:restriction>
				</xs:simpleType>
			</xs:attribute>
		</xs:complexType>
	</xs:element>
	<xs:element name="configuration">
		<xs:complexType>
			<xs:sequence>
				<xs:element ref="prop" maxOccurs="unbounded"/>
				<xs:element ref="dictionary"/>
			</xs:sequence>
		</xs:complexType>
	</xs:element>
	<xs:element name="dictionary">
		<xs:complexType>
			<xs:sequence>
				<xs:element ref="category" maxOccurs="unbounded"/>
			</xs:sequence>
		</xs:complexType>
	</xs:element>
	<xs:element name="entry">
		<xs:complexType>
			<xs:attribute name="code" use="required">
				<xs:simpleType>
					<xs:restriction base="xs:string">
						<xs:enumeration value="192.168.100.235"/>
						<xs:enumeration value="192.168.100.236"/>
					</xs:restriction>
				</xs:simpleType>
			</xs:attribute>
			<xs:attribute name="name" use="required">
				<xs:simpleType>
					<xs:restriction base="xs:short">
						<xs:enumeration value="30000"/>
					</xs:restriction>
				</xs:simpleType>
			</xs:attribute>
			<xs:attribute name="def" type="xs:string" use="required"/>
		</xs:complexType>
	</xs:element>
	<xs:element name="prop">
		<xs:complexType>
			<xs:attribute name="value" use="required">
				<xs:simpleType>
					<xs:restriction base="xs:string">
						<xs:enumeration value="../lib"/>
						<xs:enumeration value="../webapps/iswaphome/deptLogo"/>
						<xs:enumeration value="../webapps/iswaphome/finallyReport"/>
						<xs:enumeration value="../webapps/iswaphome/sysReport"/>
						<xs:enumeration value="../webapps/iswaphome/temp"/>
					</xs:restriction>
				</xs:simpleType>
			</xs:attribute>
			<xs:attribute name="key" use="required">
				<xs:simpleType>
					<xs:restriction base="xs:string">
						<xs:enumeration value="deptLogo"/>
						<xs:enumeration value="finallyReport"/>
						<xs:enumeration value="jarpath"/>
						<xs:enumeration value="sysReport"/>
						<xs:enumeration value="temp"/>
					</xs:restriction>
				</xs:simpleType>
			</xs:attribute>
		</xs:complexType>
	</xs:element>
</xs:schema>
